{
  "schema_version": "city2.agent/v1",
  "agent_id": "agt_019fc5f4-641b-7263-8b4e-79451c99dcfe",
  "aggregate_version": 1,
  "manifest_version": 1,
  "manifest_sha256": "89cd2cebaa2993b5f0e61bc22031d8bdb9f47974c9664120b9f1e068ced43da0",
  "name": "m6-ai-infra-observer",
  "role": "producer-observer",
  "department": "operations",
  "runner_policy": "deterministic-local",
  "required_capabilities": [
    "filesystem_read",
    "artifact_hashing"
  ],
  "model_policy": "none",
  "authority_class": "A0",
  "allowed_task_types": [
    "observe-producer-output"
  ],
  "tools": [
    "hash-output",
    "read-output"
  ],
  "filesystem_scopes": [
    "read:file:///home/ai-infra/ai-infra-corpus/out/ai-infrastructure-aggregates.json"
  ],
  "network_policy": "deny",
  "credential_handles": [],
  "memory_read_scopes": [],
  "memory_write_scopes": [
    "candidate:project:city2"
  ],
  "context_profile": "m6-producer-observer",
  "time_budget_seconds": 300,
  "cost_budget": {
    "max_billable_usd": "0",
    "max_input_tokens": 0,
    "max_output_tokens": 0
  },
  "concurrency": 1,
  "review_policy": "deterministic",
  "enabled": false
}
